{"basis_scene_sha256":"19ca24fce35e13657c37b885c0a4a6b86f7b7045243c763271acd939803f6ed7","case_id":"drift_A_to_B","confidence":0.94,"decision":"repair","discrepancies":[{"observed_feeder":"F1","rack_id":"N2","reason":"Render0 routes N2 cable to F1, whereas current SLD connects N2 to F2.","render_evidence_bbox_xyxy_px":[410,150,610,420],"required_feeder":"F2","sld_evidence_bbox_xyxy_px":[410,200,530,420]},{"observed_feeder":"F2","rack_id":"N3","reason":"Render0 routes N3 cable to F2, whereas current SLD connects N3 to F1.","render_evidence_bbox_xyxy_px":[660,150,870,420],"required_feeder":"F1","sld_evidence_bbox_xyxy_px":[670,200,790,420]}],"observed_render_edges":[{"bbox_xyxy_px":[180,150,360,420],"feeder_id":"F1","image_ref":"render0_wiring.png","rack_id":"N1"},{"bbox_xyxy_px":[410,150,610,420],"feeder_id":"F1","image_ref":"render0_wiring.png","rack_id":"N2"},{"bbox_xyxy_px":[660,150,870,420],"feeder_id":"F2","image_ref":"render0_wiring.png","rack_id":"N3"},{"bbox_xyxy_px":[910,150,1120,420],"feeder_id":"F2","image_ref":"render0_wiring.png","rack_id":"N4"}],"operations":[{"from":"F1","op":"replace_feeder","rack_id":"N2","to":"F2"},{"from":"F2","op":"replace_feeder","rack_id":"N3","to":"F1"}],"schema_version":"repair_patch.v1","target_revision_seen":"B","target_sld_edges":[{"bbox_xyxy_px":[150,200,270,420],"feeder_id":"F1","image_ref":"current_sld_B.png","rack_id":"N1"},{"bbox_xyxy_px":[410,200,530,420],"feeder_id":"F2","image_ref":"current_sld_B.png","rack_id":"N2"},{"bbox_xyxy_px":[670,200,790,420],"feeder_id":"F1","image_ref":"current_sld_B.png","rack_id":"N3"},{"bbox_xyxy_px":[930,200,1050,420],"feeder_id":"F2","image_ref":"current_sld_B.png","rack_id":"N4"}]}